{
  "schema_version": "2.0",
  "evidence_type": "teaching-example",
  "id": "ownership-example",
  "kind": "ownership",
  "question": "同样是教练，为什么不能读取另一个机构的计划？",
  "takeaway": "角色相同不代表资源归属相同。服务端还要检查用户与资源的机构和管理关系。",
  "reading_order": "先看两个机构边界，再读边界内各自的教练与计划。",
  "boundary": "示例仅展示数据归属，不等于实现了实际授权规则。",
  "bindings": {},
  "groups": [
    {
      "id": "tenant-a",
      "label": "机构甲",
      "children": [
        {
          "id": "coach-a",
          "label": "甲的教练"
        },
        {
          "id": "plan-a",
          "label": "甲的计划"
        }
      ]
    },
    {
      "id": "tenant-b",
      "label": "机构乙",
      "children": [
        {
          "id": "coach-b",
          "label": "乙的教练"
        },
        {
          "id": "plan-b",
          "label": "乙的计划"
        }
      ]
    }
  ]
}
